ACN,Person 1_Location Of Person,Person 1.1_Location In Aircraft,Person 1.2_Reporter Organization,Person 1.3_Function,Person 1.4_Qualification,Person 1.5_Experience,Person 1.6_Cabin Activity,Person 1.7_Human Factors,Person 1.8_Communication Breakdown,Person 1.10_ASRS Report Number.Accession Number,Person 2_Location Of Person,Person 2.1_Location In Aircraft,Person 2.2_Reporter Organization,Person 2.3_Function,Person 2.4_Qualification,Person 2.5_Experience,Person 2.6_Cabin Activity,Person 2.7_Human Factors,Person 2.8_Communication Breakdown,Person 2.9_UAS Communication Breakdown,Person 2.10_ASRS Report Number.Accession Number,Events_Anomaly,Events.1_Miss Distance,Events.2_Were Passengers Involved In Event,Events.3_Detector,Events.4_When Detected,Events.5_Result,Assessments_Contributing Factors / Situations,Assessments.1_Primary Problem,Report 1_Narrative,Report 1.1_Callback,Report 2_Narrative,Report 2.1_Callback,Report 1.2_Synopsis,objective_summary,label
1918721,Aircraft X,Flight Deck,Air Carrier,First Officer; Pilot Flying,Flight Crew Instrument; Flight Crew Air Transport Pilot (ATP); Flight Crew Multiengine,,,Training / Qualification; Time Pressure; Communication Breakdown; Troubleshooting; Workload,Party1 Flight Crew; Party2 Flight Attendant,1918721,,,,,,,,,,,,Aircraft Equipment Problem Less Severe; Deviation - Altitude Overshoot; Deviation / Discrepancy - Procedural Clearance; Deviation / Discrepancy - Procedural Published Material / Policy; Flight Deck / Cabin / Aircraft Event Smoke / Fire / Fumes / Odor,,,Person Flight Attendant; Person Flight Crew,In-flight,Air Traffic Control Provided Assistance; Flight Crew Overcame Equipment Problem; Flight Crew Landed As Precaution; Flight Crew Diverted; Flight Crew Requested ATC Assistance / Clarification; General Maintenance Action; General Flight Cancelled / Delayed,Human Factors,Human Factors,Flight from ZZZ to ZZZZ; flying a route down to coast to avoid weather Severe WX. Between ZZZ1 and ZZZZZ Captain did a normal system monitor check. Upon looking at the COND page; he noticed the AFT Cargo Temp at 180 degrees (Steady Green); asked me if I had seen a temp that high; I replied No! We kept an eye on it; over the next 10 minutes; noticed it rising to 188 degrees; then 194 degrees (still Steady Green) where it stayed for the duration of the flight. This made us uncomfortable for normal Cargo Bay temperatures in my 3;000+ hours flying this aircraft at 2 different airlines have never exceeded cabin temperatures during cruise. We simultaneously started looking into what could be a catastrophic problem. I got into the QRH AOM/FOM/and other manuals to look for temperature limitations and fixes. I found none; anywhere. During the same time; Captain got on the Phone with Operations and phone patched to Maintenance Control; where they attempted multiple resets to no success. When Captain got off the phone with Maintenance; he said; 'Well nothing fixed It; and they (Maintenance) said we are on our own.'At that point; we agreed as a crew that we didn't know what was going on down there. We were both not comfortable taking an aircraft with this indication over water; with limited divert options to an international location; and with no company or Contract Maintenance at the destination not knowing what was going on down there. The indication was steady at this point; not rising higher [than] 194 degrees; nor giving any other indications to the back when we notified the Flight Attendants and told them what was going on. At this point; we felt we were not in a land as soon as possible scenario; but in a land as soon as practical scenario but keeping land as soon as possible options available and we decided to divert to ZZZ2. We gave ATC a PAN PAN call since we were going to a divert airport that wasn't our alternate but that we were not at the time an emergency aircraft; we just wanted to have all our bases covered. We notified Dispatch both via phone patch and ACARS. During descent we were cleared the ZZZZZ Arrival to ZZZ2.We were still grossly overweight with a lot of gas; so we referenced the overweight Checklist. With that; we decided that with the condition still not worsening from what had been continuously indicated with no secondary indications or issues coming from the cabin; Captain and I both agreed that in an effort not to compound the problem we should hold to burn down gas; but having immediate [landing] options nearby; so we held at ZZZZZ1 at 16;000 ft. for 30-40 min and got to a calculated weight that would put us on deck in ZZZ2 right at Max landing weight. We continued to ZZZ2 via the arrival; for an uneventful Runway XX landing. On a side note; the XX transition from the ZZZZZ Arrival is a bit of a slam dunk. We asked for a bit longer final to get down; stabilized; and situated; and ATC approach gave us a few last second altitude; headings; and speed amendments through final which started to task saturate us as we prepared for landing. For example: open descent from 6;000-3;000; we were told to amend altitude and maintain 4;000 ft. while passing 4;200 feet; thrust idle; and speed brakes out. We blew through the altitude and had to climb back up Auto Pilot off; ALT horn blaring; and engines spooling up to 80+%; and getting speed brakes back in. We were also given several headings through final; and were asked to slow to final approach speed 10 plus miles outside the final approach fix at 4;000 feet; and approach didn't give us an approach clearance until we had flown through the glide slope on the localizer; and had to join from above; in order to sequence aircraft landing [Runway] XYL; which started to compound our landing configuration planning; and a go around was not something we were hoping to do; especially off of a PAN PAN call. We later found that on a couple of occurrences; ATC did not pass the PANPAN or divert info from Center to Center to Approach. We were later reassigned upon arrival to fly a ZZZ3 Turn that left in 5 minutes.I told Company that we just went through a lot; and that if they wanted us to fly that turn; that I needed a break for an amount of time that I was setting; some food; and so the Captain and I went and had a sit down meal; decompressed; talked about what had happened; after an hour or so I assessed my fitness for duty and felt I was good to fly the turn. The Captain and I were sitting on the jet; and when we called for push going to ZZZ3; Ramp told us to hold and that Maintenance wanted to talk to us. The maintenance team member got on the radio; asked if we were the crew that brought Aircraft X in from ZZZ; I replied yes; and he told us we needed to fill out a fume report. Captain asked what he was talking about; and told him this was the first we have heard about any fume incident. The Maintainer on the radio said the Flight Attendants had filed a fume report after the flight; and we needed to do the same. The Flight Attendants never told us anything about fumes nor their intent to fill out any such reports. Captain then filed a fume report said he had no information to give for we knew nothing about it. I felt Captain had communicated very clearly what was going on to the flight attendants about the situation; and our intent to divert. They had never communicated any such issues during any duration of or after the flight. Unknown from the high temperature in the Aft Cargo Bay. We did later saw that Maintenance replaced the sensor in the aft cargo bay via the app. We were curious that with all the ZZZ team members in Training vests if maybe they stacked the bags in the aft cargo bay above the line and possibly covered the sensor or did something to It. However; As far as the 'suspected' fume event; there was no communication from the flight attendants to the cockpit crew for this event. We noticed via the app that Maintenance later deferred the APU to prevent 'further fume events' due to the suspected fume event we were later notified about from ZZZ2 Maintenance. Not sure why if there is a fume event (or even a suspected fume event) why they don't further investigate the problem or fix the problem; rather than just pencil whip it into deferment. If there was any fumes in this situation; how would MX (Maintenance) know they came from the APU and not from any potential problem we were encountering? Put quick reference limitations on a Cockpit Card or in the QRH or checklist to quickly reference for situations such as these. I felt like we were on an Easter egg hunt for something that we later found wasn't there which wasted a lot of our decision making time. I know that Airbus FCOM (Flight Crew Operations Manual) and other manufacture manuals/reference material has such limitations for quick reference from my experience at a previous Airbus airline. Why can't the company get on board with Airbus??? Make sure Flight Attendants communicate to the cockpit if they were smelling fumes.,,,,A321 First Officer reported an abnormally elevated Aft Cargo Bay temperature during cruise. After conferring with maintenance; the flight executed a precautionary diversion for maintenance.,"The incident involved an A321 flight crew (Party 1) and a flight attendant (Party 2). During the flight, the crew noticed an abnormally high aft cargo bay temperature (194 degrees), which was above standard operating parameters. The crew consulted manuals and contacted maintenance but found no immediate solution. Concerned about the situation, particularly over water with limited diversion options, the crew decided to divert to ZZZ2. They made a PAN PAN call to inform ATC and contacted dispatch. During descent and landing at ZZZ2, the crew encountered challenges with overweight landing conditions and ATC communication, but the landing was uneventful. Post-landing, maintenance informed the crew that a fume report had been filed by the flight attendants, though the crew had no prior knowledge of fumes or related issues during the flight. Maintenance deferred the APU to prevent further fume events. The crew expressed concerns about the lack of communication from the flight attendants regarding the suspected fume event and questioned the adequacy of maintenance's response. They recommended improved communication protocols between the cockpit and cabin crew, better access to quick reference materials for such situations, and a more thorough investigation of potential issues instead of deferred fixes.",fume/smoke incident
1789902,Aircraft X,Flight Deck,Air Carrier,Captain; Pilot Flying,Flight Crew Instrument; Flight Crew Air Transport Pilot (ATP); Flight Crew Multiengine,,,Communication Breakdown; Troubleshooting,Party1 Flight Crew; Party2 Flight Attendant,1789902,Aircraft X,Flight Deck,,Pilot Not Flying; First Officer,Flight Crew Multiengine; Flight Crew Instrument; Flight Crew Air Transport Pilot (ATP),,,Communication Breakdown; Troubleshooting,Party1 Flight Crew; Party2 Flight Attendant,,1789899.0,Deviation / Discrepancy - Procedural Published Material / Policy; Flight Deck / Cabin / Aircraft Event Smoke / Fire / Fumes / Odor,,,Person Flight Attendant,Taxi,Air Traffic Control Provided Assistance; Aircraft Equipment Problem Dissipated; Flight Crew Requested ATC Assistance / Clarification; Flight Crew Returned To Gate; Flight Crew Overcame Equipment Problem; General Maintenance Action,Human Factors; Aircraft,Human Factors,While taxing to the gate and on the terminal ramp the 4th Flight Attendant called up and stated there was smoke in the cabin. She stated 'could be electrical'. I stopped the aircraft; I got a minor whiff of something but it dissipated immediately. FO (First Officer) smelled nothing. We reported smoke in the cabin to ground and requested Airport rescue and Fire Fighting. We considered running the Smoke/AVIONICS SMOKE/Fumes but needed more information; (global assessment). I called up the 1st and she stated she was unaware of what was going on. I called back to the rear of the aircraft and 2nd stated it had begun to dissipate. After a brief discussion with FO; I elected to taxi to the gate and have Airport Rescue and Fire Fighting follow us and access the situation. Aircraft deplaned normally. 1st was unaware there was an issue 4th thought it was an electrical odor 2nd stated there was an odor but not a burning odor. He noticed a lite haze in the reading lights. [The possible cause] was primarily due to the dark cabin; communications among cabin crew. In a perfect world; there would have been better communication between all of the flight attendants; prior to calling up the flight deck. A more concrete assessment could have made with all eyes on the situation. Then the degree of urgency; and solid information can be transmitted more efficiently to the Captain.,,Taxiing to the gate on the terminal ramp we received a cabin call from the #4 FA (Flight Attendant) reporting smoke in the cabin. CA stopped the aircraft to assess the situation and asked if I smelled smoke or odor. I did not see or smell smoke or odor in the cockpit. CA said he sensed a brief odor but not burning. We called ground to request Airport Rescue and Fire Fighting due to the cabin smoke report. We discussed completing the Smoke/AVIONICS SMOKE/ Fumes checklist but after a follow up call to the FAs about the cabin environment the #1 said she didn't see or smell smoke or odor and #2 and #4 said the smoke/odor had dissipated. Due to close proximity to the gate CA decided to continue to the gate for further evaluation by the Airport Rescue and Fire Fighting personnel. The smoke report was entered in the AML and the fumes report [was] completed.,,A319 flight crew reported a fume/smoke event during arrival taxi to gate.,"An A319 flight encountered a fume/smoke event during its arrival taxi to the gate. The incident began when the fourth flight attendant (FA4) detected an odor and reported smoke, suspecting it might be electrical. The flight crew, led by the captain, halted the aircraft and assessed the situation. The captain noticed a brief whiff of something, while the first officer detected nothing. They contacted ground control and requested the Airport Rescue and Fire Fighting (ARFF) team. The flight crew considered their checklist for smoke/fumes but sought more information. Upon contacting the cabin, FA1 reported no smoke or odor, while FA2 noted a dissipating odor and a light haze in the reading lights. The captain, after consulting with the first officer, decided to proceed to the gate for ARFF evaluation. The aircraft landed smoothly, and passengers deplaned normally. The event highlighted the challenges of communication among cabin crew in a darkened cabin. The suggested improvement was enhanced communication to ensure a more informed and coordinated response, allowing for a clearer assessment and more efficient information transfer to the flight deck. The incident underscores the importance of effective communication among cabin crew to enhance incident handling and preparedness.",fume/smoke incident
1750764,Aircraft X,Flight Deck,Air Carrier,Captain; Pilot Flying,Flight Crew Multiengine; Flight Crew Instrument; Flight Crew Air Transport Pilot (ATP),,,Communication Breakdown; Troubleshooting,Party1 Flight Crew; Party2 Flight Attendant,1750764,Aircraft X,Flight Deck,Air Carrier,Pilot Not Flying; First Officer,Flight Crew Multiengine; Flight Crew Air Transport Pilot (ATP); Flight Crew Instrument,,,Communication Breakdown,Party1 Flight Crew; Party2 Flight Attendant,,1750770.0,Aircraft Equipment Problem Less Severe; Deviation / Discrepancy - Procedural Published Material / Policy; Flight Deck / Cabin / Aircraft Event Smoke / Fire / Fumes / Odor; Inflight Event / Encounter Bird / Animal,,,Person Flight Attendant,In-flight,Flight Crew Overcame Equipment Problem,Human Factors,Human Factors,Upon initial climbout from ZZZ about 1 minute after takeoff at 2500 feet MSL; the flight deck vent airflow decreased significantly. Engine; pressurization and pack indications were normal. The FO (First Officer) and I noticed that I had adjusted the temperature selectors full cold due to the very humid 100 degree conditions at ZZZ. We both agreed that the air conditioning systems had likely iced up based on previous aircraft experience. The FO selected higher temperatures to melt any ice. About a minute later; airflow returned to normal. At the same time we received an interphone call; which the FO answered; from FA1 (Flight Attendant 1) saying hot air was flowing into the cabin and it smelled like dirty socks. The FO said we turned the temperature up but would now turn it down and to call back if the problem did not get better. Cool air returned to the flight deck and cabin and we continued to ZZZ1 uneventfully. During the post flight walk around at ZZZ1; the FO discovered a bird strike in the right engine with feathers on the bypass fan blades and core compressor blades. During the van ride to the hotel; FA2; FA3; & FA4 said they called FA1 during the hot airflow incident on initial climbout and reported they smelled burned chicken; cooked chicken; and a burned bird strike smell. When FA1 called the flight deck; she said it smelled like dirty socks. My decision to continue to ZZZ1 would have [been] different if I had heard any words like burned; cooked; chicken; or bird strike. The decision of FA1 to not relay the very accurate observations of FA2; FA3; & FA4 to the flight deck was not good and could have allowed serious consequences to develop including engine failure; engine destruction; human injuries or loss of life. As a Captain; I listen very carefully to the observations of flight attendants and consider everything seriously. I suggest flight attendants do the same for each other.,,Upon initial climb out from ZZZ about a minute after takeoff about 2;500 ft; the flight deck vent airflow decreased significantly. Engine; pressurization and packs indications were normal. The CA (Captain) and I noticed that he had adjusted the temp. selectors to full cold due to very humid 100 degree conditions at ZZZ. We both agreed that the air conditioning systems had likely iced up based on previous aircraft experience. I turned the selectors at a higher temperatures to melt any ice. About 1 minute later; the airflow returned to normal. At the same time we received a call from the cabin. I answered it and FA1 (Flight Attendant 1) saying the hot air was flowing into the cabin and smelled like dirty socks. Which I repeated 'dirty socks' to make sure that was the smell. I told her we turned the temp up but would now turn it down. Also to call back it the smell or heat didn't get any better. I also called back about 5 min later to check on the smell and temp. The FA's did say the smell was going away or gone and temp was cooling down better. With the cool air returned to the flight deck and cabin; and we continued to ZZZ1 uneventfully. During the post flight at ZZZ1 I discovered a bird strike in the right engine. There was feathers on the bypass fan blades and the core compressor blades. During the van ride to the hotel; FA2; FA3; and FA4 said they called FA1 during the hot airflow incident on the initial climb out and reported they smelled burnt chicken; cooked chicken; and or a burnt bird strike smell. When FA1 called the flight deck she said it smelled like dirty socks. His decision to continue to ZZZ1 would have been different if he had heard any words like burnt; cooked; chicken; or bird strike. The decision of FA1 not relaying the very accurate observations of FA2; FA3 and FA4 to the flight deck was not good and could have allowed to something more serious.,,B737-800 flight crew reported communication issues between the flight deck crew and flight attendant crew regarding odor in the cabin.,"During the climbout from ZZZ after takeoff at 2,500 feet MSL, the flight crew noticed a significant decrease in airflow through the flight deck vents. The Captain adjusted the temperature selectors to full cold due to the extremely hot and humid conditions at ZZZ. Both the Captain and the First Officer (FO) believed the air conditioning systems had iced up based on prior experience. The FO then increased the temperature settings to attempt to melt any ice, and airflow returned to normal shortly afterward. At the same time, the flight deck received an interphone call from Flight Attendant 1 (FA1), who reported that hot air was flowing into the cabin and that it smelled like ""dirty socks."" The FO assured FA1 that the temperature would be adjusted and instructed her to call back if the issue persisted. The airflow and temperature in both the flight deck and cabin subsequently returned to normal, and the flight continued to its destination, ZZZ1, without further incident. Following the flight, the Captain discovered evidence of a bird strike on the right engine during the post-flight walk-around, including feathers embedded in the bypass fan blades and core compressor blades. During the ride to the hotel, other flight attendants (FA2, FA3, and FA4) reported that they had called FA1 during the initial climbout and detected smells resembling ""burnt chicken,"" ""cooked chicken,"" or a ""burnt bird strike"" odor. However, FA1 only described the smell as ""dirty socks"" when contacting the flight deck. The Captain emphasized that had he been aware of the more specific descriptions provided by the other flight attendants, his decision to continue to ZZZ1 might have been different, as the smells could have indicated a more serious issue such as engine damage or failure. The Captain highlighted the importance of clear and accurate communication among all crew members. He suggested that flight attendants should relay specific and precise observations to the flight deck to ensure that potential issues are fully understood and addressed. This could prevent more serious consequences, such as engine failure or other safety risks.",fume/smoke incident
