1516706,Aircraft X,Flight Deck,Air Carrier,Captain,Flight Crew Air Transport Pilot (ATP); Flight Crew Instrument; Flight Crew Multiengine,,,Communication Breakdown; Time Pressure,Party1 Flight Crew; Party2 Flight Attendant; Party2 Flight Crew,1516706,,,,,,,,,,,,Deviation / Discrepancy - Procedural FAR; Deviation / Discrepancy - Procedural Published Material / Policy; Flight Deck / Cabin / Aircraft Event Passenger Electronic Device; Flight Deck / Cabin / Aircraft Event Smoke / Fire / Fumes / Odor; Flight Deck / Cabin / Aircraft Event Passenger Misconduct,,Y,Automation Aircraft Other Automation; Person Flight Attendant,In-flight,Flight Crew Overcame Equipment Problem,Human Factors; Procedure,Human Factors,Approximately two hours following our departure; the Flight Attendants (FA) notified me of smoke emanating from the aft lavatory (aircraft right) immediately following its use by a passenger. Additionally the passenger reported he saw smoke emanating from the overhead panel in the lavatory. Uncharacteristic of him simply smoking in the lavatory; but possibly something much more serious and potentially life-threatening; an actual aircraft fire. The smoke alarm was activated and projecting an extremely loud and piercing tone throughout the cabin. This caused distress among passengers as well as the FA's. Communicating with the FA's over the interphone was very difficult due to the combined chaotic nature of the alarm and the chaos surrounding its activation. The FA's were having difficulty extinguishing the alarm. I did not know if this was due to continued smoke; or some delay in extinguishing the alarm. Our collective belief was the situation could be much more serious. The FA's asked me for assistance in evaluating the situation. I knew my assistance in the aft of the aircraft would be a departure from our standard protocol. However; based on the information we received at the time; I concluded my assistance might very well mitigate a further degradation in the cabin and secure a safe condition as quickly as possible. The First Officer had demonstrated confidence and technical competence; thus I had no reason to doubt her ability to navigate and control the aircraft; as well as communicate with outside agencies while I assisted the FA's with what appeared and sounded to be a rapidly deteriorating situation. In the interest of time and consequently safety; I elected to personally inspect and evaluate the severity of the incident. I did this in order to determine the most expeditious course of action regarding continuing to [our destination] or turning back.As we were mere minutes from the critical point on our flight plan there was only one FA present in the forward part of the aircraft during the time I exited the flight deck. I shut the flight deck door before the forward FA could enter the flight deck. After working with the FA's to silence the alarm and after inspecting the lavatory and it's overhead panel; I determined there was no immediate threat of an actual aircraft fire; as there was no evidence of heat; burning; or residual smoke. I instructed the FA's to lock the lavatory; and reassess every few minutes. After I returned to the front of the aircraft; I established communication with the First Officer via interphone; and advised her I was ready to return to the flight deck; (after approximately 4-5 minutes). The smoke did not continue; so I opted to continue to [our destination]; as long as the condition didn't reappear. For reasons unknown to me; the First Officer left her seat to open the door rather than pushing the unlock button. About twenty minutes later; the FA's found an electronic cigarette in the toilet that was discarded in what appears to be an attempt to conceal its presence and cause for the smoke. After the passenger (who reported the smoke emanating from the overhead portion of the lavatory) was asked about the device; he did admit it was the cause for the smoke and activation of the smoke detector. I felt in the interest of safety; it was best to leave the flight deck and assess the situation personally; and that would be the most expeditious way to evaluate an overall course of action.At no time during the above events did I intentionally disregard standard procedure; rather I utilized my authority as the Captain to bring the situation to safe conclusion while being mindful of [Company policies].,,,,B737 Captain reported leaving the flight deck to evaluate smoke in the aft lav caused by a passenger's electronic cigarette.,"The incident involved a B737 flight crew responding to smoke in the aft lavatory, which was traced to a passenger's electronic cigarette. Upon notification, the smoke alarm activated, causing cabin chaos. The captain, departing from standard protocol, left the flight deck to personally assess the situation, concluding no immediate fire hazard existed. After extinguishing the alarm and inspecting the lavatory, the captain instructed the flight attendants to lock the lavatory and monitor the situation. Despite the First Officer's departure from standard procedure by opening the flight deck door, the captain returned and decided to continue the flight to the destination. Later, the flight attendants found the electronic cigarette, confirming its role in the incident. The captain's actions prioritized safety, aligning with company policies.",fume/smoke incident
1412286,Aircraft X,Flight Deck,Air Carrier,Captain; Pilot Not Flying,Flight Crew Air Transport Pilot (ATP),Flight Crew Last 90 Days 227; Flight Crew Type 8000,,Communication Breakdown,Party1 Flight Attendant; Party2 Other,1412286,,,,,,,,,,,,Deviation / Discrepancy - Procedural Security; Flight Deck / Cabin / Aircraft Event Passenger Misconduct,,Y,Person Flight Attendant,In-flight,General Police / Security Involved,Company Policy; Human Factors,Human Factors,While in cruise about 45 minutes out from ZZZ; the First Officer needed a physiological break. We called the flight attendants and (in accordance with standard operating procedures) the FO stepped out of the cockpit and a FA came in; closing the cockpit door behind him. While the FO was in the lavatory; a female passenger came up to the forward galley. The FA informed her that she must use one of the lavatories in the back of the aircraft or return to her seat; but that she could not remain in the forward galley. The passenger was Hispanic and claimed not to understand the FA. Luckily; all three of the FAs spoke fluent Spanish and it was again explained in Spanish. The passenger still refused to move and she verbally abused and threatened the FAs. A deadheading male FA came up to assist. The 'A' FA called up to inform me what was going on. I could hear loud voices over the interphone and the FAs speaking to the passenger in Spanish. Meanwhile; the FO had exited the lavatory and was now also in the galley. After several more minutes; the passenger's husband came up and convinced her to return to her seat. After she was seated and with the three FAs plus the male deadheading FA guarding and blocking access to the forward galley and the cockpit door; the cockpit door was opened and the FA exited the cockpit and the FO entered. We then locked down the cockpit in accordance with a Threat Level 1. I contacted Dispatch with our status and requested to have law enforcement meet the aircraft in ZZZ. After arriving in ZZZ; law enforcement removed the passenger from the aircraft.After speaking with the FO over the interphone; and visually confirming the galley was secure; I determined that it was safer and more prudent to have the FO in the cockpit for the remainder of the flight. This scenario needs to be addressed during recurrent security training. What is the safest course of action if the cockpit is locked down with one of the pilots in the cabin? If it is determined that keeping the cockpit on lockdown is the safest course; where should the FA sit? In the jumpseat or in a pilot seat?,The reporter stated that this encounter with a passenger was more of a misunderstanding; but it brought up the bigger issue of what to do if the threat is real. If a real threat was just outside the cockpit door with the first officer out of the cockpit with a single pilot and flight attendant in the cockpit; what is the proper procedure? Do you put the FA in the pilot's seat where they have access to the flight controls; but you can keep an eye on him/her? Do you put the FA in the jumpseat where you can't see them? The reporter mused 'could the FA be in on it'; what is really happening on the other side of the door? The reporter stated that he feels unprepared for which procedure should the pilot use for these type of scenarios. He feels more training should occur addressing these issues.,,,B737-800 Captain reported that a passenger refused to leave the forward galley while the First Officer was using the forward lavatory causing a security issue.,"The incident occurred during the cruise phase of a B737-800 flight about 45 minutes prior to landing at ZZZ. The First Officer (FO) required a physiological break and temporarily left the cockpit to use the forward lavatory. A flight attendant (FA) entered the cockpit in accordance with standard procedures, closing the door behind them. During the FO's absence, a Hispanic passenger approached the forward galley. The FA instructed the passenger to either use one of the rear lavatories or return to her seat, as she was not permitted to remain in the galley. The passenger, who did not understand English, was initially uncooperative. However, the three FAs, who spoke fluent Spanish, repeatedly explained the situation. Despite this, the passenger refused to comply, verbally abused, and threatened the FAs. A deadheading male FA was called to assist. The 'A' FA informed the Captain via interphone, who heard loud voices and ongoing dialogue between the FAs and the passenger in Spanish. The FO, having exited the lavatory, joined the situation in the galley. After several minutes, the passenger's husband intervened and persuaded her to return to her seat. With the passenger seated and the FAs, including the male deadheading FA, positioned to block access to the forward galley and cockpit door, the cockpit door was opened. The FA exited the cockpit, and the FO returned. The cockpit was then secured in accordance with Threat Level 1 protocols. Upon arrival at ZZZ, law enforcement was summoned to remove the passenger from the aircraft. The Captain, after consulting with the FO and visually confirming the galley's security, determined it was safer for the FO to remain in the cockpit for the remainder of the flight. The incident highlighted the need for recurrent security training, particularly addressing scenarios where the cockpit is locked down with one pilot in the cabin. The discussion raised questions about the safest seating arrangement for an FA in such situationswhether in the jumpseat or a pilot seat.",fume/smoke incident
1441841,Aircraft X,Flight Deck,Air Carrier,Captain; Pilot Flying,Flight Crew Air Transport Pilot (ATP),Flight Crew Last 90 Days 155,,Distraction; Communication Breakdown; Workload,Party1 Flight Crew; Party2 Flight Attendant,1441841,,,,,,,,,,,,Flight Deck / Cabin / Aircraft Event Passenger Electronic Device; Flight Deck / Cabin / Aircraft Event Smoke / Fire / Fumes / Odor,,,Person Flight Attendant,In-flight,Flight Crew Requested ATC Assistance / Clarification,Human Factors,Human Factors,We were on the arrival into [destination] when the Flight Attendants notified us there was an electronic device emanating smoke in the cabin. I directed the flight deck crew to don oxygen masks and set the regulators to 100 percent and established crew communication. I then [advised] ATC and asked for direct [destination]. Shortly thereafter; the Flight Attendants notified us that the device and its spare batteries (which were also in a state of thermal runaway) were contained in the ion battery emergency containment bag and there was no smoke.The device was apparently an e-cigarette. As the device was contained and there was no smoke; I elected to discontinue the QRH. However; the flight deck crew remained on oxygen for the duration of the approach and landing. Approach and landing were uneventful. My biggest concern is that after attempting to notify the Flight Attendants that we were on oxygen; I never called them back. They were making announcements on my first attempt and I simply dropped calling them back off my to-do list. They were surprised when we landed and were surrounded by Fire Rescue.Distraction management continues to be an issue for all flight crews. As a Check Airman; I should have done a better job of communicating. Better use of all my resources would have kept this from happening. I found myself doing the lion's share of the work in the cockpit when I had a very competent First Officer to help me. Simply dividing a few more of the tasks would have freed up my mind and allowed me to think more clearly.,,,,B737 Captain reported the flight crew donned oxygen masks and asked for direct destination after a Flight Attendant reported smoke in the cabin related to thermal runaway of an e-cigarette battery.,"The incident occurred during the arrival into [destination] when smoke was reported in the cabin due to an e-cigarette battery experiencing thermal runaway. The flight crew donned oxygen masks, communicated with the flight deck team, and requested a direct approach to [destination]. The flight attendants successfully contained the device and its spare batteries in an ion battery emergency containment bag, resolving the smoke issue. Despite the situation being controlled, the flight crew remained on oxygen throughout the approach and landing. Upon landing, the flight crew was surrounded by Fire Rescue, surprising the flight attendants who had been making announcements. The incident highlighted a communication lapse, with the captain failing to follow up with the flight attendants after initially notifying them of the oxygen use. The captain acknowledged the need for better resource management and delegation, recognizing that shared responsibilities could have mitigated the distractions and improved communication.",fume/smoke incident
1270787,Aircraft X,Flight Deck,Air Carrier,Captain; Pilot Not Flying,Flight Crew Air Transport Pilot (ATP),,,Distraction; Troubleshooting; Confusion; Communication Breakdown,Party1 Flight Crew; Party2 Flight Attendant,1270787,,,,,,,,,,,,Aircraft Equipment Problem Less Severe; Deviation / Discrepancy - Procedural Published Material / Policy; Flight Deck / Cabin / Aircraft Event Smoke / Fire / Fumes / Odor,,,Person Flight Attendant; Person Flight Crew,Aircraft In Service At Gate,General Evacuated,Human Factors; Aircraft,Human Factors,Upon arrival into Airport ZZZ; after completing the parking checklist; and after opening the L1 door; the two forward flight attendants; the first officer; and I smelled a faint fuel smell; which we all assumed; and agreed was coming from outside the aircraft; given that there was an aircraft right next to us fueling; our APU was running; and the winds were gusting from the northwest; which was directly towards our tail at the gate. My first officer and I also discussed the likely possibility of a fuel spill somewhere near us on the ramp. In my experience on the MD-80 it is not uncommon to get a faint; exhaust like fume smell in the air conditioning system; and thick condensation during hot; muggy summer nights such as this one was in ZZZ. I assume the smell was stronger in the cabin than in the cockpit since both the FO and I had our air vents closed. The flight attendants requested that I make a PA stating that everything was ok and there was no cause for alarm and we are aware of the condensation and smell; which I did. The two forward flight attendants also informed me that 'they opened the doors in back' which I thought meant that the two rear flight attendants had opened the rear aircraft doors for ventilation. Our number three and one FAs; meant to inform me that passengers were exiting through the over wing exits. This was a simple misunderstanding that was caused by task saturation in the cockpit; monitoring the APU indications; and determining the cause of the smell. I was later informed that passengers took it upon themselves to open all four over wing exits and exit onto the wing. I was told that it was estimated that 15-20 people were on each wing at one point. Our number two flight attendant vocally told passengers to stop exiting through the over wing exits. The FA had no chance to prevent passengers from initiating the uncommanded evacuation given the crowded aisle and interior that is typical of everyone standing when the seat belt sign is turned off. Our number four flight attendant made a PA instructing passengers to stop and to not evacuate or exit though the over wing exits. I did not hear this PA. The FO and I opened our air vents and the fuel odor got stronger and the condensation thickened. I then shut off the Ram Air; APU AIR switch; and both packs; which caused the fuel smell to lessen considerably in intensity and the condensation stopped completely. A man who works the ramp came up to the cockpit and told us we had fuel leaking out of the APU. I then told him to connect external power and I began to shut down the APU. I also told the first officer to go outside and inspect the APU fuel leak with the ops personnel. We informed ground of the fuel leak and we requested ARFF to come inspect the area as a precaution; which they did. I was told by the gate agent that only one person had jumped off the left wing. I was told by operations and my flight attendants that a few passengers came back into the airplane through the over wing doors; and the rest exited the wings on baggage belt loaders. There were no injuries that I know of. This was confirmed by all four flight attendants and ZZZ operations personnel. Upon inspection of the APU; fuel was in fact leaking out of the non-ram door area and the fuel spill was about fifteen feet in diameter. I was instructed by maintenance to pull 5 circuit breakers; which I did; secured the airplane with the securing check; and made the appropriate entries in the maintenance logbook.,,,,A fuel odor; later identified as an APU fuel issue; was detected as passengers began to deplane at the gate. A partial; uncommanded; evacuation was initiated by several passengers via the over wing exits. No injuries were reported.,"The incident occurred after a flight arrived at Airport ZZZ and completed its parking checklist. Upon opening the L1 door, the flight crew and forward flight attendants detected a faint fuel smell, which they initially attributed to external factors such as a neighboring aircraft being fueled, the APU running, and gusty northwest winds. The flight attendants requested the cockpit to make a passenger address (PA) to reassure passengers, which was done. However, there was a misunderstanding regarding the status of the aircraft doors and exits. Passengers, believing there was an emergency, opened the over wing exits and began exiting onto the wings without authorization. Despite efforts by the flight attendants to stop the uncommanded evacuation, several passengers exited before being directed back into the aircraft. The fuel smell intensified, leading the flight crew to shut off the APU and air conditioning systems, which reduced the odor and condensation. A ground staff member informed the cockpit of a fuel leak near the APU, prompting the crew to secure the aircraft, shut down the APU, and request ARFF (Aircraft Rescue Fire Fighting) support as a precaution. Maintenance personnel inspected the APU and identified a fuel leak. The crew secured the aircraft, performed the necessary checks, and documented the issue in the maintenance logbook. No injuries were reported, and the situation was resolved without further incident. The cause of the fuel odor was later identified as a fuel leak from the APU, which was addressed by maintenance.",fume/smoke incident
1279697,Aircraft X,Flight Deck,Air Carrier,Pilot Flying; Captain,Flight Crew Air Transport Pilot (ATP),,,Situational Awareness; Communication Breakdown,Party1 Flight Attendant; Party2 Other,1279697,,,,,,,,,,,,Deviation / Discrepancy - Procedural FAR; Flight Deck / Cabin / Aircraft Event Passenger Electronic Device; Flight Deck / Cabin / Aircraft Event Smoke / Fire / Fumes / Odor; Flight Deck / Cabin / Aircraft Event Passenger Misconduct,,Y,Automation Aircraft Other Automation; Person Flight Attendant,In-flight,Flight Crew FLC complied w / Automation / Advisory; Flight Crew Took Evasive Action; General Police / Security Involved,Human Factors; Procedure; Company Policy,Human Factors,Passenger in aft lav with e-cigarette caused Lav Smoke ECAM warning during climb out at about 12;000 ft. Flight attendants quickly took care of the situation. ECAM message cleared after a few seconds. Reported incident to Dispatch and they said GSC (Ground Security Coordinator) agent would meet us at the gate in our filed destination. Passenger didn't know e-cigarettes were not allowed. Possibly mention e-cigarettes not allowed during F/A passenger briefing.,,,,A passenger smoking an e-cigarette in the aft lavatory during climb caused the ECAM and AFT LAV Smoke Detector to alert. The flight attendants notified the passenger about the deviation which allowed the alert to cease. The flight attendant cabin passenger briefing does not alert about the e-cigarette prohibition.,"The incident involved a passenger who smoked an e-cigarette in the aft lavatory during the climb at 12,000 feet, triggering the ECAM warning and the smoke detector. The flight attendants promptly addressed the situation by informing the passenger, leading to the alarm being resolved. The crew notified dispatch, who arranged for a Ground Security Coordinator to meet them at the destination. The passenger was unaware that e-cigarettes are prohibited on board, highlighting the need to include this information in the passenger briefing.",fume/smoke incident
