ACN,Party1_Role,Party2_Role,objective_summary,label
1197528,Flight Attendant,Flight Crew,"The incident involved two hard landings on a B737-800 aircraft, experienced by two flight attendants during separate flights. In both cases, the landings were described as abnormal, with the aircraft feeling unstable and the pilots failing to communicate effectively with the cabin crew or passengers afterward. The first landing occurred during final approach, with the aircraft feeling too high before touchdown. The plane bounced upon impact, with the right wing tip nearly touching the ground, causing concern among the flight attendants about a potential crash. After the incident, the pilots did not address the crew or passengers, leaving the flight attendants unsettled. The second landing was similarly hard, with the aircraft bouncing multiple times and the wings tilting dangerously low. The flight attendants reported that the captain, who was apparently new to the left seat, lost control during the flare. After landing, the captain did not communicate with the crew, and the first officer mentioned the captain's inexperience as a possible contributing factor. Both incidents occurred under clear weather conditions, with no apparent external factors. The flight attendants expressed frustration over the lack of communication from the pilots and the unresolved nature of the incidents. They also noted that the captain may have been practicing with max flaps 40, which is typically reserved for short runways, as a potential factor in the hard landings. The flight attendants removed themselves from their duties following the second incident, citing the traumatic nature of the events and their concern for safety. The chief pilot acknowledged the issue but did not provide a definitive resolution, leaving the flight attendants shaken and uncertain about future flights. The attendants suggested that the captain, who was new to the left seat, may require additional training, particularly regarding the appropriate use of flaps during landing. They also emphasized the need for better communication between pilots and cabin crew in the event of an incident.",crew-related issues
1199064,Flight Crew,Flight Attendant,"The incident occurred during the pre-departure phase of a flight, involving the Flight Crew and ground personnel. The Flight Crew encountered issues with the ACARS system, which was deferred, and the inoperative printer. Despite initial normal functionality during setup, they received conflicting messages about a maintenance release and aircraft readiness. Before addressing this, they had to handle concerns from the flight attendants regarding an armed passenger, a dog onboard, and a verbal conflict with a gate agent over overhead bin space. After resolving these issues, the crew pushed back and started engines, only to realize they lacked a maintenance release. Maintenance attempted to send the release digitally but failed, opting instead to deliver a hard copy via the cockpit window. The flight crew proceeded safely with the hard copy. The incident was caused by communication system failures and conflicts, leading to the delayed acquisition of necessary documentation, but the flight continued without further issues.",crew-related issues
1206553,Flight Crew,Flight Attendant,"The incident occurred during the takeoff of a B737 aircraft when both the flight crew and cabin crew encountered unexpected challenges. The cabin crew had not completed their final safety checks and announcements when the 'clear for departure' chime sounded. As a result, the cabin crew was still in the aisle when the aircraft began takeoff, leading to one flight attendant being thrown and struggling to secure their harness. The flight crew also faced difficulties as a flight crew member was thrown against the galley, dropping their equipment. The cause was the cabin crew's inability to finish their safety procedures before takeoff. The process involved the premature initiation of takeoff without the cabin being secure. The result was a safety concern due to the crew's struggles during takeoff. A proposed solution was for the flight deck to wait for the cabin to be secure before allowing takeoff.",crew-related issues
1207005,Flight Attendant,Flight Crew,"The incident involved a Flight Attendant who noticed that the main cabin door stairs on a CRJ-700 aircraft were incorrectly configured during a Maintenance C-Check. The misconfiguration affected the door's handgrip, instruction placards, emergency lights, and exit procedures, potentially hindering emergency evacuations. Upon discovering the issue while closing the cabin door, the Flight Attendant informed the captain and insisted on contacting Maintenance and reviewing procedures before the flight could proceed. This action ensured the problem was addressed, preventing potential delays or cancellations. The proposed solution was to engage maintenance and verify procedures, which was implemented to resolve the issue.",crew-related issues
1215213,Flight Crew,Party1 Flight Attendant,"The incident involved an EMB-145 aircraft operated by a flight crew from ZZZ to ZZZ1 and back. During the deadhead trip, the crew heard a squeal in the cabin and reported it to maintenance. Maintenance requested the crew to start engines with the cabin door closed and proceeded to manually pressurize the cabin to 3.0 psi without informing the crew. This resulted in uncomfortable ear pressure for the crew and the flight attendant, who has a hearing impairment, leading to her removal by a doctor. The root cause was the maintenance team's failure to brief the crew, lack of a checklist, and reliance on verbal procedures. The captain later discovered that the procedure followed wasn't the standard one, and this wasn't the first such incident, highlighting potential dangers of verbal communication in extreme environments. The proposed solutions include establishing written company procedures for maintenance and crew assistance, and consulting medical experts for safer pressurization standards. The outcome emphasized the need for clear communication and standardized procedures to prevent future incidents.",crew-related issues
1221672,Flight Attendant,Flight Crew,"The incident occurred when a Flight Attendant and a Flight Crew member were involved in aircraft maintenance. The aircraft had logged maintenance issues that were addressed by the maintenance team, including the Flight Attendant. Upon leaving the aircraft, the Flight Attendant noticed an unfolding ELT lanyard. The Mechanist removed the ELT for repair and instructed the Flight Attendant to inform the crew to log the issue. However, the aircraft departed without the ELT, as the Mechanist returned to find it had left early. The cause was likely a communication breakdown, with the Flight Attendant failing to inform the crew, possibly due to being distracted. The result was a potential safety issue with the missing ELT. The proposed solution was for the Flight Attendant to note the discrepancy in the logbook or remove it.",crew-related issues
1237435,Ground Personnel,Flight Attendant,"The incident occurred when a flight attendant crew, delayed by 1 hour and 19 minutes due to weather conditions, snow, and de-icing, arrived at the gate to find that boarding had already begun for their flight without them. The ground personnel had started the process of boarding the aircraft, with approximately 10-15 passengers on board, including an unaccompanied child and crew members stowing personal luggage, despite the flight attendants not having completed their pre-flight safety checks. The flight attendants were initially mistaken for another crew due to a miscommunication. After verifying their identities and confirming that no other crew was on board, the original flight attendant crew proceeded to board the aircraft. The situation was resolved when the original crew assumed their duties, but the incident highlighted the importance of proper crew communication and pre-flight preparation to ensure passenger safety.",crew-related issues
1241070,Flight Crew,Flight Attendant,"The incident involved a CRJ-700 flight crew and a flight attendant. The flight crew was distracted by unusual nose gear sounds during taxi-out, which they later attributed to cold weather conditions at the airport. Due to this distraction, the crew failed to complete the Before Takeoff checklist, resulting in them forgetting to inform the flight attendants of the readiness for takeoff. After climbing through 10,000 feet, the flight attendants notified the crew of the missed procedure, as one attendant had to rush back to her seat. The crew apologized, reviewed the events, and identified the missed checklist as the cause. The proposed solution was to slow down and verify all procedures after any anomaly before takeoff.",crew-related issues
1244422,Flight Attendant,Flight Crew,"The incident occurred on a regional jet during a flight when a Flight Attendant (FA) discovered that the prerecorded passenger safety briefing incorrectly stated that life vests were stored under the seats. The aircraft in question does not have life vests under the seats, as it has never been equipped with them. The FA reported this discrepancy to the flight deck after reaching 10,000 feet, informing the First Officer (FO) and subsequently the Captain (CA) about the issue. The FA also mentioned that she had previously reported this problem to management but had not received a resolution. During the communication, the FO misunderstood the FA's intent and believed she was indicating that the aircraft was missing life vests. This misunderstanding led the FO to inform the CA that an emergency landing was necessary. The CA, unaware of the confusion, prepared for a code yellow emergency landing, informing the passengers and directing the FA to contact management immediately. The FA vehemently denied having suggested that life vests were missing, emphasizing that she had pointed out the safety video's inaccuracy. The situation escalated when the CA called the FA again, revealing that the FO had misrepresented the situation. The CA admitted that the previous communication about the emergency landing was a joke, causing further confusion and distress for the FA. The FA felt targeted and upset, particularly when the CA laughed off the situation and corrected the timeline for landing, leaving the passengers and crew uninformed about the delay. The breakdown in Crew Resource Management (CRM) was further evident when the flight deck failed to provide a proper descent announcement, requiring the FA to inform the passengers herself. Upon landing, the CA made a demeaning comment about the FA's luggage, which was overheard by the other Flight Attendant. The incident resulted in a significant breakdown of CRM, impacting the professionalism and safety of the flight. The FA suggested addressing the faulty safety video as a solution to prevent similar issues in the future.",crew-related issues
1244950,Flight Crew,Flight Attendant,"The incident involved a conflict between a Flight Attendant and the Flight Crew of an ERJ-175 aircraft. The Flight Attendant reported that the cabin was not properly secured for landing due to a lack of communication from the flight deck. The flight crew was preoccupied with weather concerns and attempting to decide whether to divert to an alternate airport. Despite the Flight Attendant's repeated warnings that the cabin was not ready, the flight crew proceeded with landing. The aircraft landed safely and taxied to the gate without further incident. The captain later apologized, acknowledging that the cabin safety had been overlooked due to their preoccupation with weather conditions. The Flight Attendant suggested that the flight crew should have prioritized ensuring cabin safety by going around and delaying the landing if necessary, even if it meant diverting to the alternate airport.",crew-related issues
1331524,Flight Attendant,Flight Attendant,"The incident involved a weather-related diversion of an MD-80 flight, causing a three-hour ground delay. During the delay, flight attendants managed medical situations, including a passenger experiencing nausea and a claustrophobic episode, while also addressing passenger unrest. Despite challenges with cabin service and communication, the crew eventually re-boarded the aircraft and proceeded to the original destination, ensuring a safe arrival. The flight attendants coordinated with ground staff for hotel arrangements, concluding a taxing day with fatigue.",crew-related issues
1122923,Flight Attendant,Ground Personnel,"The incident involved a conflict between a flight attendant and a ground personnel supervisor over closing the aircraft door prematurely. The supervisor aimed to close the door 11 minutes before departure, despite the flight attendant's communication that overhead bins were still open and passengers were boarding. The supervisor proceeded to close the door despite the flight attendant's instructions, violating FARs and causing an ongoing issue. The flight attendant highlighted the need for adherence to safety protocols, and the recurring nature of the problem suggests a potential need for improved communication or procedural changes to prevent future occurrences.",crew-related issues
1159185,Flight Crew,Flight Attendant,"The incident occurred after the aircraft landed and was taxiing to the gate. The seatbelt sign was inadvertently turned off by the Captain while attempting to adjust the taxi light. This led the cabin crew to believe the aircraft had arrived at the gate. The Lead Flight Attendant instructed passengers to return to their seats and continue moving, as stowing luggage wasn't feasible. Upon reaching the gate, the correct signal was given, allowing a quick deplaning. The crew's prompt action ensured passenger safety despite the initial confusion.",crew-related issues
1159810,Flight Attendant,Ground Personnel,"The incident involved a conflict between a Flight Attendant and Ground Personnel over the improper handling of an electric wheelchair on an aircraft. The Ramp Agent requested the Flight Attendant to open the 2R door from the inside to load the wheelchair onto a catering truck, despite company policy prohibiting such actions. The Agent Supervisor and Inflight Supervisor insisted on the door being opened, ignoring the Flight Attendant's safety concerns and explanations that doors should only be opened from the outside. After the door was opened, it was discovered that the lift vehicle intended to remove the wheelchair could not access the door opening, resulting in a thirty-minute delay. The wheelchair owner later expressed frustration, stating that if consulted, she could have resolved the issue without opening the door. The supervisors failed to consider alternative solutions or safety protocols, unnecessarily putting the Flight Attendant at risk. The incident highlights the importance of adhering to safety procedures and consulting all parties before making decisions that compromise safety.",crew-related issues
1163132,Flight Attendant,Ground Personnel,"The incident involved a flight attendant who experienced illness after exposure to cleaning chemicals with strong fumes used by ground personnel. The flight attendant encountered the odor during preflight and when emptying trash, leading to dizziness, blurred vision, nausea, dry heaves, and vomiting. Despite measures like drinking water and resting, symptoms persisted, prompting notifications to the domicile, supervisor, and union. The union noted previous attempts to halt the practice, and the flight attendant remained off work two weeks later. A proposed solution was to cease using cleaner in the oven.",crew-related issues
1167498,Flight Attendant,Flight Crew,"The incident involved a conflict between a flight attendant and the captain regarding the presence of security seals on the cabin crew oxygen mask compartments above the forward and aft jumpseats. The flight attendant noticed the compartments were sealed and raised concerns with the captain, who initially instructed her to consult the Flight Attendant Manual for a list of approved locations for the seals. After failing to locate the list, the flight attendant contacted the inflight office supervisor, who then reached out to maintenance. The captain became upset, accusing the flight attendant of contacting maintenance without consulting him first. Despite the flight attendant's clarification that she had sought resolution through proper channels, the captain reprimanded her. Following further communication, maintenance confirmed that the compartments should not be sealed, and the flight attendant removed the seals. The captain reiterated his disapproval, and the flight experienced a 16-minute delay. The incident highlighted the need for maintenance to adhere to proper procedures and for the captain to consider flight attendants' safety concerns more carefully.",crew-related issues
1177277,Flight Crew,Flight Attendant,"The incident involved a conflict between the flight crew and the flight attendant regarding the use of an inoperative In-Flight Entertainment (IFE) system on a B777 aircraft. The IFE system was placarded as inoperative (MEL 23-10) and the captain had instructed the purser not to use it for passenger safety briefings or other pre-recorded announcements. Despite this directive, the purser attempted to use the system during the safety briefing, believing it was functional based on communication with maintenance personnel. After the flight, the captain addressed the issue with the purser, emphasizing the captain's authority as the final decision-maker regarding the use of company equipment. The purser argued that maintenance had indicated the system was functional. The captain stressed the importance of adhering to MEL directives and the potential risks associated with using unapproved systems, referencing past incidents involving IFE malfunctions. The incident highlighted a gap in understanding of placarding procedures, with the captain proposing that guidance on MEL/CDL/NEF placarding should be simplified and standardized, particularly for systems in the cabin. Additionally, the captain recommended ensuring cabin crew awareness of the captain's authority and the importance of coordinating with the flight deck before using systems that are placarded inoperative. The B777 captain discovered that the purser had attempted to use the inoperative IFE system for passenger safety briefings despite being explicitly instructed not to do so. The purser believed the system was functional based on communication with maintenance. The captain emphasized the importance of adhering to MEL directives and clarified their authority as the final decision-maker. The incident underscored the need for clearer guidance on placarding procedures and cabin crew coordination with the flight deck.",crew-related issues
1185838,Flight Attendant,Flight Crew,"The incident occurred during a flight involving an A320 aircraft. Approximately 15-20 minutes after takeoff, moderate turbulence was experienced in the rear of the aircraft. The Aft Flight Attendant requested the Captain to turn on the seatbelt sign due to the instability, but the Captain refused, stating, ""I am in control of the seatbelt sign and I am not turning it on."" The flight attendant, along with the other Aft Flight Attendant, expressed disbelief and concern over the Captain's response, feeling it disregarded their safety and that of the passengers. The flight attendants deferred to a deadheading pilot for guidance, who also expressed shock at the Captain's refusal. Fearing for their safety, the flight attendants delayed service until conditions stabilized. Later, the Captain instructed the flight attendants to sit down via the public address system, despite the absence of turbulence at the time. The flight attendants felt the Captain's actions demonstrated a lack of concern for their safety and the passengers', leading to a loss of respect and trust in his judgment. The flight attendants considered the behavior a serious safety issue and stated they would feel uncomfortable flying with the Captain again. No resolution was explicitly proposed in the incident.",crew-related issues
1058785,Flight Attendant,Maintenance,"The incident involved a First Officer who reported that the Left-Hand (LH) Chip Detector Light was illuminated during the preflight inspection of their CRJ-200 aircraft. After discussing the issue with the Captain, they decided to divert to ZZZ1 due to concerns about potential delays at the outstation. Upon arrival, Maintenance discovered sufficient debris in the chip detector, leading to the aircraft being removed from service for oil system flushing and reinspection. Contributors to the incident included the lack of clear guidelines for flight crew regarding the chip detector light, which is not part of the standard preflight inspection. The First Officer noted that the light frequently illuminated during the first flight of the day at outstations, and the difficulty of obtaining timely Maintenance support at remote locations compounded the decision to delay reporting. This was the second occurrence in two months, with the first five instances requiring only a simple cleaning of the detector. To prevent future occurrences, the First Officer recommended the establishment of clear guidelines for flight crew actions when the chip detector light is illuminated, aiming to address confusion and reduce the risk of similar incidents.",crew-related issues
1059220,Flight Attendant,ATC,"The incident involved a conflict between a flight attendant (Party1) and Air Traffic Control (ATC) at Lafayette Airport. The flight attendant reported receiving taxi clearance to Runway 4R via Bravo and Juliette. After confirming the clearance with the first officer and referencing the airport diagram, the crew began taxiing. They momentarily stopped on Runway 4L for safety checks and continued toward Juliette. Upon reaching Juliette and turning right, they stopped before crossing Runway 11 and received a call from Ground Control regarding a possible deviation. Ground Control provided a phone number and later cleared the crew to cross Runway 11 and proceed to Runway 4R. Upon reaching the holding short area, the Tower informed the crew that they had crossed Runway 4L without clearance. The flight attendant stated that the crew had intended to follow the taxi clearance as understood, which they believed included crossing intervening runways. The flight attendant attributed the misunderstanding to the taxi clearance instructions, which they claimed were ambiguous and different from the usual format (""Taxi Runway 4R via Bravo and hold short Runway 4L""). The first officer reportedly misapplied the instructions, leading to the unintended crossing of Runway 4L. The crew ultimately followed the corrected instructions and resolved the situation without further incident.",crew-related issues
1072425,Flight Attendant,Ground Personnel,"The incident occurred due to a toilet paper roll falling into the aft right toilet during a previous flight, causing a backup. The toilet paper holder was missing, and toilet paper was left on the sink counter. The ground crew, wearing hazmat suits, conducted a clean-up but failed to remove the aft galley carts, allowing toilet water to seep under them. This resulted in additional overflow during taxi and takeoff, saturating the cabin flooring, carpets under rows 23-25, and the aft galley. The flight attendant reported the issue and recommended replacing the soaked carpets, noting complacency as a contributing factor. The aircraft remained operational, but thorough cleaning and carpet replacement were necessary.",crew-related issues
1081192,Flight Attendant,Flight Attendant,"The incident involved a conflict between two flight attendants regarding the improper storage of empty aluminum cans in the New Tech electrical carts used for heating and cooking meals on a B747-400 aircraft. The junior flight attendant reported that storing aluminum cans in the carts could lead to electrical malfunctions, explosions, or residue buildup that might harm future operations. Despite their concerns, the more experienced flight attendants dismissed the issue, stating it was a longstanding practice. The junior attendant emphasized the safety risks and lack of proper training on the aircraft's electrical systems, expressing frustration over what they perceived as unsafe habits contributing to mechanical issues. The incident highlighted a potential safety hazard and called for improved training on the proper use of the carts.",crew-related issues
1095337,Flight Crew,ATC,"The incident occurred shortly after takeoff when a flight attendant used an internal code (""XXXX"") to signal an emergency to the flight crew. The flight crew, unfamiliar with this code, perceived it as a serious situation such as a fire, leading them to declare an emergency and return to the departure airport. Upon landing, it was discovered that the emergency involved a passenger experiencing a heart attack, with flight attendants administering CPR. The flight crew praised the attendants' quick response but highlighted the confusion caused by the internal jargon. To prevent future misunderstandings, it was proposed to enhance training and awareness regarding the use of such codes among all crew members.",crew-related issues
