ACN,Party1_Role,Party2_Role,objective_summary,label
1687578,Dispatch,Flight Crew,"The incident arose from a combination of poor management decisions and miscommunication within the dispatch team, leading to a highly task-saturated workload and operational breakdown. The root cause included the reduction of international desks without adjusting the workload, assigning a domestic dispatcher to an international desk during peak hours, and insufficient staffing planning. These decisions overwhelmed the remaining dispatchers, who were forced to handle an influx of calls and re-routing of flights while managing their own workload. Additionally, a flight attendant's lack of proper radio telephone protocol compounded the issue during a medical emergency, requiring the intervention of a Chief in training to assist the overwhelmed domestic dispatcher. The result was a near-disruption of operations, with the flight being diverted due to the poor planning and lack of support. The dispatcher highlighted several systemic failures, including inadequate staffing models, lack of trained leadership, and insufficient training for flight attendants. Proposed solutions included restoring proper staffing levels, having dedicated international and domestic chiefs, and improving training for both dispatchers and flight attendants to prevent similar incidents.",crew-related issues
1687718,Flight Crew,Flight Attendant,"The incident was triggered by the Captain's failure to issue the standard ""prepare for departure"" command before takeoff. Upon hearing a chime, the flight crew, including the flight attendant, assumed it might be a routine call light. Without the Captain's command, they stood in the galley during takeoff. The carts were not secured, requiring the crew to hold them in place to prevent movement. This situation posed a safety risk, as the crew was not properly positioned for takeoff, potentially hindering their ability to respond to emergencies. To prevent recurrence, it was emphasized that the Captain must consistently issue the ""prepare for departure"" command to ensure clarity and safety for the cabin crew.",crew-related issues
1687735,Flight Attendant,Dispatch,"The incident occurred due to confusion regarding crew assignments. A flight attendant was called to assist with pre-boarding a flight to ZZZ and was informed by the gate agent that they would board as the incoming crew was delayed. After boarding, the pilot announced they were departing, and the attendant noticed a discrepancy in their assigned trip on the crew portal. During taxi, the attendant's phone rang from crew scheduling, prompting them to answer despite knowing they shouldn't use their phone on the aircraft. This led to a policy violation. The result was a reprimand for the flight attendant, who received additional training on communication protocols. This incident highlights the importance of adhering to established procedures, particularly regarding electronic device usage during critical flight phases.",crew-related issues
1687743,Flight Attendant,Flight Crew,"During a flight, a safety incident occurred when the flight crew initiated pushback without ensuring the cabin door was closed, violating Federal Aviation Regulations (FAR). The flight attendant, conducting a compliance check in first class, noticed the door remained open and informed the captain that the cabin was not secure. Despite this, another flight attendant incorrectly reported the cabin as secure, leading to the pushback proceeding. This action posed a significant security risk. The flight attendant believes the incident highlights the need for improved training to prevent such violations and ensure adherence to safety protocols.",crew-related issues
1696357,Flight Attendant,Other,"The incident involved a Flight Attendant (Party1) who noticed a passenger of small stature seated in the overwing exit row. During boarding, the Flight Attendant was distracted and did not immediately assess the passenger's ability to assist in an emergency. Another Flight Attendant confirmed the passenger's capability without further evaluation. Post-departure, the Flight Attendant questioned the passenger's height and mobility, noting she was approximately 42 inches tall and weighed 80-90 lbs., making it unlikely she could perform necessary tasks. The concern arose due to the risk of discrimination claims and negative media, which deters Flight Attendants from challenging such situations. The result highlighted the need for a proposed solution: evaluating passengers' abilities before assigning exit row seating.",crew-related issues
1714749,Flight Attendant,Other,"The incident involved a passenger (Party2) and a flight attendant (Party1) aboard a flight. The flight attendant discovered three smokeless cigarette butts in the first-class cabin near the passenger's seat. Despite the passenger appearing to sleep with a blanket over his head, the flight attendant noticed the butts and an odor she initially dismissed as clothing scent. Upon deplaning, the flight attendant and a colleague confronted the passenger about the butts, explaining it was a fineable offense. The passenger responded with explicit language, blaming the butts on his pocket and claiming he had already filed a negative review. During the flight, the passenger was confrontational, complaining about alcohol service and using offensive language. He disregarded crew instructions to remain seated and made inappropriate comments. His behavior disrupted the cabin environment and created a hostile atmosphere for the crew.The flight attendants also managed a situation where they allowed extra forms for families with elderly grandparents, despite a shortage. The passenger falsely accused them of misconduct, which was later proven baseless. The result was a disruptive and hostile environment for the crew, prompting concerns about the passenger's potential legal action or future banning from the airline. The flight attendant documented the passenger's behavior, highlighting his defiance and disregard for crew responsibilities.",crew-related issues
1716229,Flight Attendant,Flight Attendant,"The incident involved a conflict between two flight attendants (FAs) regarding a failure to communicate information about the First Officer's status as a Federal Flight Deck Officer (FFDO). The lead FA had instructed another FA to inform the crew that the First Officer was an FFDO after the aircraft door had closed. However, due to a hectic pre-takeoff taxi process, where passengers repeatedly needed to be reminded to sit down and fasten their seatbelts, the information was inadvertently forgotten. The lead FA proposed a potential solution: implementing a system in the computer to denote FFDOs with a triangle symbol, which could help ensure the information was readily accessible during busy boarding or pre-takeoff procedures. The incident resulted in the other FAs not being informed about the First Officer's role as an FFDO, but a solution was suggested to prevent similar occurrences in the future.",crew-related issues
1718343,Flight Attendant,Flight Crew,"During a B737-900 flight, a Flight Attendant discovered a large hard-covered box in the overhead bin, which a passenger identified as a drum set containing a lithium battery. The attendant expressed concerns about the item's size, its inability to fit into a battery containment bag, and the presence of lithium batteries, particularly since the flight was scheduled to operate over water for five hours. The attendant sought clarification from the Customer Service Representative (CSR) and the Captain regarding the item's approval but did not receive satisfactory answers. The Captain acknowledged the presence of other lithium battery-powered devices on board, such as cell phones and laptops, but deemed the drum set acceptable. The attendant raised questions about the lack of thorough research into the item and proposed that such items should be checked more carefully before departure. The incident highlights concerns about lithium battery safety and the need for proper review procedures.",crew-related issues
1724682,Flight Attendant,Other,"The incident involved a communication breakdown between a flight attendant and a catering representative regarding the placement of two carrier boxes filled with dry ice in front of the boarding door. The flight attendant was not initially informed about an inoperative chiller, which the catering representative cited as the reason for leaving the boxes on the ground. The boxes posed a tripping hazard to passengers boarding the aircraft, but the catering representative refused to remove them, insisting the flight attendant take them on board. The boxes were too heavy for the crew to lift safely, and an In-Flight Supervisor present in the area was unhelpful and displayed aggressive behavior when the flight attendant attempted to resolve the issue. During the conflict, the Captain informed the crew that chiller number 7 in the aft galley had an issue, but the crew had not been previously notified. To de-escalate the situation and avoid further delays, the flight attendant decided to take the two bins of dry ice herself, carrying them onto the aircraft. This allowed the boarding door to close and the flight to depart on time.",crew-related issues
1607955,Flight Crew,Flight Attendant,"The incident involved an ERJ-175 flight crew and a flight attendant during departure from ZZZ. After starting the first engine, a warning indicated a forward door was ajar. The flight crew communicated with the attendant to check and recycle the door. During this, the emergency slide deployed, an inadvertent deployment with no injuries. The cause was attributed to a miscommunication regarding the term ""recycle,"" leading to confusion. Contributing factors included a delayed flight and rushed procedures. To prevent recurrence, the flight manual's terminology will be revised for clarity, and procedures will be followed more meticulously.",crew-related issues
1608871,Flight Attendant,Flight Attendant,"The incident involved a flight attendant who encountered a passenger emitting the odor of marijuana. The passenger admitted to smoking marijuana throughout the day and refused to comply with instructions to move to the mid to aft cabin. Flight attendants noticed the passenger's behavior, including his glossy eyes and loud demeanor, and expressed concerns about his condition. They debated whether he should be removed from the overwing window exit seat due to safety concerns. The flight deck was informed but did not provide a verbal response. The A Flight Attendant deemed the passenger acceptable, while others, including the B and C Flight Attendants, disagreed, noting the passenger's behavior and the potential risks of marijuana use. The situation highlighted the need for clarification in the Flight Attendant Manual regarding the definition of ""intoxicated"" to include substances like marijuana, despite its legal status in some states. The crew's handling of the situation and the adequacy of their judgment were questioned.",crew-related issues
1608882,Flight Attendant,Other,"The incident involved a passenger who was vaping marijuana on a flight, leading to a conflict with the flight attendants. The flight attendants noticed a strong smell of marijuana when the passenger exited the aft lavatory and observed smoke inside the lavatory. The passenger appeared paranoid and initially lied to the police about his actions. The flight attendants called the captain, and upon landing, police were summoned. During questioning, the passenger denied using marijuana but later admitted to smoking in the cabin and lavatory after a vape pen, which tested positive for THC, was found in his possession. The passenger was detained, and the flight attendants reported the incident to the authorities. The flight attendant experienced throat irritation and a headache, possibly due to the effects of THC exposure. The police confirmed the vape pen contained THC, leading to the passenger's confession and detention.",crew-related issues
1611412,Flight Attendant,Ground Personnel,"The incident involved a taxiway incursion at EWR airport, reported by the B767 Captain. The contributing factors included poor weather conditions (icing, rain, and mist), which reduced visibility, and split radio communications between the Captain (on ground frequency) and the First Officer (on ramp frequency). During nighttime winter operations, the Captain received confusing taxi instructions from the ramp and mistakenly turned right on Taxiway R, crossing Runway 11/29. After realizing the error, the Captain set brakes, confirmed communication frequencies with the crew, and contacted Ground for clarification. Ground cleared the aircraft to continue taxiing to the gate. The crew safely reached the gate without further incident and conducted a debriefing. Contributing factors highlighted the need for improved taxiway signage in the area and better communication protocols during winter operations.",crew-related issues
1615868,Flight Attendant,Flight Crew,"The incident involves concerns raised by a flight attendant regarding the excessive use of the seat belt sign by flight deck crews, particularly captains, on multiple flights. The flight attendant reported that captains frequently left the seat belt sign on for the entire duration of flights, which ranged between 6.5 to 9.5 hours. Some captains even made pre-flight announcements about this practice. The flight attendant attempted to address this issue with the captains using CRM strategies, but the captains cited concerns about liability in case of severe turbulence and claimed they were minimizing compliance checks for flight attendants during late-night flights as reasons for their actions. The flight attendant expressed deep concern over the negative safety culture this behavior was fostering, as it encouraged passengers to ignore the seat belt sign and created complacency among flight attendants. During one flight, the flight attendant observed at least 15 passengers in the aisle while the seat belt sign was on, approximately seven hours into the flight, following breakfast service. This situation violated Federal Aviation Regulations (FAR) 121.311 and portions of 121.571. The flight attendant noted that this behavior occurred more frequently on long-range flights. No specific solution was proposed in the context of the incident, but the flight attendant emphasized the need for addressing the safety risks associated with the misuse of the seat belt sign.",crew-related issues
1616108,Flight Attendant,Flight Crew,"The incident involved a conflict between a flight attendant and the flight crew regarding cockpit entry/exit procedures. The flight attendant adhered to training and manual protocols, which require lavatory doors to be locked during cockpit access. However, some pilots have verbally instructed the flight attendants to keep the lavatory doors open, a practice not aligned with established procedures. During a recent flight, the flight attendant briefed the captain on the required security measures, but the captain refused to acknowledge them, forcing the flight attendant to leave the lavatory doors open. This compromise in security left the cockpit vulnerable. The flight attendant expressed concern over the inconsistency between training and pilot directives, which could potentially undermine safety protocols.",crew-related issues
1617785,Flight Crew,Flight Attendant,"The incident occurred during the descent of a B737-800 aircraft into ZZZ, approximately 20 minutes before landing. The Number 1 Flight Attendant (FA) sustained a minor injury when his head struck a metal tray in the cabin while standing in the forward cabin. The Number 3 FA reported the injury to the flight deck via interphone, initially appearing frantic and vague. The Number 2 FA also attempted to communicate the situation. The captain, after calming the Number 3 FA, learned that the Number 1 FA was conscious, had a small bruise, and declined medical assistance. The Number 1 FA reported a minor headache but felt capable of continuing the flight. The flight landed without further issues, and the Number 1 FA requested a supervisor to meet the aircraft upon arrival at ZZZ1. The incident was attributed to a lack of awareness of the surrounding environment, though no turbulence or external factors were involved. The Number 3 FA was noted to have communication room for improvement in handling the situation.",crew-related issues
1623939,Flight Attendant,Other,"An incident occurred during a flight due to a Gate Agent's pushy behavior and the flight attendant's distraction. The flight attendant was delayed in assisting an elderly passenger five rows back, managing numerous bags, and dealing with frequent lavatory usage. This led to the exit row passengers not being briefed until after boarding delays and an aisle blockage from a backpack. The flight attendant eventually briefed the exit row passengers after realizing the oversight. The incident highlights the impact of distractions and boarding delays on safety protocols.",crew-related issues
1659303,Flight Crew,Flight Attendant,"An incident occurred involving a conflict between the flight crew and a flight attendant regarding an inaccurate passenger count prior to departure. The flight captain noticed a discrepancy in the ""Souls On Board"" count, initially reporting 144 souls (138 passengers, 1 infant, and 5 crew) based on the Weight and Balance report. The flight attendant, however, stated there were 139 passengers plus an infant. Upon investigation, it was discovered that the infant was in a lap, not a seat. The flight crew consulted with the gate agent and verified the counts. A boarding pass had not been scanned, leading to the error. The gate agent confirmed the count and provided an updated Takeoff Data version, prompting a recalculation of the Before Push Checklist. The flight proceeded normally after the resolution. The flight captain highlighted that such discrepancies often occur due to unverified boarding passes or gate agents assuming counts are accurate without confirmation. They emphasized the critical importance of accurate passenger counts for aircraft weight calculations and emergency response, proposing that the FAA require a return to physically counting passengers before departure, despite the time it may take. This practice, the captain argued, ensures the safety and accurate accounting of lives on board.",crew-related issues
1542026,Flight Attendant,Flight Crew,"The incident occurred on a CRJ900 flight when the final descent chime, intended to alert the cabin crew, malfunctioned and did not sound. As a result, the flight attendants were not promptly informed of the aircraft's preparation for landing. Approximately 20 minutes before landing, the initial descent announcement was made, and the flight attendants began securing the galley and performing last-minute tasks. However, the absence of the final descent chime caused them to remain unaware of the impending landing until they noticed street lights outside the aircraft, indicating that the landing gear was being extended. In response, the flight attendants rushed to secure the cabin and assist passengers. During this rush, the forward flight attendant was pushed into a jog and yelled for the aft attendant to ""Get down."" The aft attendant safely reached her jump seat, while another flight attendant collided with the flight deck door, sustaining a head injury. Due to the sudden and stressful situation, neither attendant was able to fully secure the cabin or galley before landing. The first officer reported that he had activated the chime but faced a system malfunction. The captain subsequently filed an incident report post-landing. This incident highlights the importance of reliable communication systems in ensuring passenger and crew safety during critical phases of flight.",crew-related issues
1565089,Flight Attendant,Flight Crew,"The incident involved a conflict between a Flight Attendant and a Flight Captain regarding the operation of a flight with an inoperative interphone system. The Flight Attendant reported that the interphone system, which is a critical communication link between the flight deck and cabin, was not functioning. According to the aircraft manual, the aircraft should not depart if the interphone system is inoperative. However, the Captain insisted that the flight could proceed by opening the flight deck door during takeoff and landing as an alternative protocol. The Flight Attendant expressed discomfort with this approach, as it contradicted the manual, but was reportedly pressured and guilted by the Captain into complying with the protocol for four consecutive flights. The incident highlights issues within the company, including overloading its fleet and crew capacity, aircraft disrepair, and a culture where those who raise concerns about safety are punished, while those who operate flights illegally are rewarded financially. The Flight Attendant had previously raised concerns with multiple senior management personnel, including the Director of Operations, who acknowledged the potential safety risk but did not take definitive action to prevent the flight. The Captain, known for maximizing his flying hours and earnings, was not held accountable for his protocol, despite the risks involved. In summary, the incident reflects systemic management and safety concerns within the organization, including disregard for safety protocols, crew well-being, and regulatory compliance. A potential solution proposed was to review the manual's requirements, assess the Captain's flight hours, and investigate the interphone system's compliance with the MEL (Minimum Equipment List).",crew-related issues
1581007,Flight Attendant,Other,"A conflict occurred between a CRJ flight attendant and the crew scheduling department regarding the manipulation of block time for a trip originating from JFK. The flight attendant reported that the crew scheduling adjusted the block time to keep the operation within the 16-hour work period, despite the crew having already waited over five hours at JFK for the aircraft to arrive. The attendant and a coworker were informed that they were approaching the 26-hour mark and were at 15:43 hours when contacted. Although the flight was delayed by an additional 40 minutes, the block time was shortened, resulting in an earlier arrival but a later departure. The flight attendant expressed concern over this scheduling decision, citing fatigue and safety risks, and refused to work beyond the 16-hour limit. The attendant viewed the situation as a safety issue due to the potential impact of fatigue on crew performance. No specific solution was proposed in the context provided.",crew-related issues
1585177,Flight Attendant,Maintenance,"The incident involved a conflict between a Flight Attendant and Maintenance personnel regarding the resolution of aircraft maintenance issues on a CRJ-900 aircraft. The Flight Attendant reported two problems during boarding: a protruding aft cargo L/H blowout panel and a broken upper track guide screw on the forward lav door. Maintenance was summoned, and a Line Mechanic noted that the blowout panel was missing three of four fasteners. A Foreman arrived and assured the Flight Attendant that the issues had been resolved, claiming a new panel had been installed and signed off. However, the Flight Attendant later discovered that the old panel had only been taped in place without the missing fasteners. The Foreman's story changed, claiming the fasteners had been found and reinstalled, but this was contradicted by the Line Mechanic, who admitted no new fasteners had been installed. The Flight Attendant raised concerns, leading to a reinspection by Maintenance, which confirmed the panel was still missing fasteners. A new panel was ordered, and passengers were deplaned and reboarded multiple times due to delays. Despite the replacement, the forward lav door again failed during the flight, with the broken screw reinstalled. Maintenance ultimately installed a new door, but it did not fit properly, causing metal-on-metal contact and difficulty in operation. The Flight Attendant expressed strong concerns about the Foreman's dishonesty and unsafe practices, which could have led to a potential accident. The incident resulted in a 4-hour and 16-minute delay. The Flight Attendant emphasized the need for accurate maintenance signoffs, honesty, and thoroughness to prevent such incidents in the future. The aircraft was eventually cleared for flight after the issues were addressed.",crew-related issues
