ACN,Party1_Role,Party2_Role,objective_summary,label
2068792,Flight Attendant,Flight Attendant,"A flight attendant discovered an open biohazard bag containing soiled linens, wipes, and a dustpan behind the last row of economy seats after the plane had pushed back from the gate. The attendant, wearing gloves, investigated the contents and reported the issue to the captain. The crew decided to seal the bag and continue the flight, though they expressed discomfort with having the biohazard on board. The situation could have been prevented with more time for thorough cleaning and pre-boarding checks.",crew-related issues
2102491,Flight Attendant,Flight Attendant,"The incident involved an off-duty Flight Attendant (Party1) who attempted to assist during a safety procedure on a flight. The aircraft experienced an issue with the landing gear, prompting the captain to conduct a preparation for land evacuation demonstration. During this time, Party1, who was in uniform and seated in the cabin, volunteered to assist by taking on the role of FA #8 at the jump seat in the aft galley. However, the Purser (Party2) denied this offer, instructing Party1 to return to their seat in the cabin, stating that only working Flight Attendants should be involved in the safety procedure. After landing, the off-duty Flight Attendants (deadhead crew) were reassigned to work the next departing flight, which caused significant fatigue due to being awake for approximately 27 hours. This decision was particularly challenging because the deadhead crew had less time available compared to the on-duty crew, who were subsequently released from their duties. The inconsistency in treatment and the denial of assistance led to frustration among the deadhead crew, who felt their efforts and well-being were overlooked despite being part of the same incident. A proposed solution is to ensure fair treatment and consideration for all crew members, including those deadheading, in such situations.",crew-related issues
2119017,Flight Attendant,Ground Personnel,"The incident involved a flight attendant who was informed by a passenger that their checked luggage contained an electric razor and a camera, potentially housing lithium batteries. The attendant initially failed to notify Operations or the Captain, possibly due to uncertainty about the items. Upon realizing the oversight, the attendant informed an Operations Agent upon arrival, leading to the passenger's bags being pulled before their connecting flight. The attendant reflected on the importance of safety and suggested enhancing procedures to reduce human error through better screening of checked baggage for lithium batteries.",crew-related issues
2172923,Flight Attendant,Other,"The incident occurred on a flight from ZZZ to ZZZ1, involving a passenger (Party2) and a flight attendant (Party1). The cause was the passenger's refusal to check her bag for an international trip, leading to a confrontation. The process began with the passenger insisting her bag fit in the overhead compartment, which the flight attendant redirected to the front attendant. When the passenger was denied, she became upset, yelled at the flight attendant, and filled out a complaint form during the flight. The result was the passenger opening multiple overhead bins and taking photos, prompting the flight attendant to secure the galley and notify the captain. The captain was informed about both this misconduct and a separate issue involving a passenger's bag with lithium batteries. The proposed solution involved notifying the captain to handle these issues through appropriate channels.",crew-related issues
1978886,Flight Attendant,Flight Attendant,"The incident involved a situation where the nose gear of a flight was reported to be malfunctioning, remaining in the down position. The captain informed the flight attendants, Person A and the narrator, of the issue and stated that they would circle to burn fuel and wait for further instructions from air traffic control. The attendants followed procedures, synchronized their watches, and prepared for further updates. After 14 minutes, the captain addressed the passengers, confirming the return to the original destination for a normal landing. Ten minutes later, the captain called the attendants to confirm that all gears, including the nose gear, were down and functioning properly, allowing for a safe landing. The attendants completed their pre-landing checks, made announcements, and ensured passenger safety. The plane landed as scheduled,Taxiied to the gate, and passengers were deplaned. The flight was then switched to another aircraft and departed from a different gate, concluding the incident without further complications.",crew-related issues
1918721,Flight Crew,Flight Attendant,"The incident involved an A321 flight crew (Party 1) and a flight attendant (Party 2). During the flight, the crew noticed an abnormally high aft cargo bay temperature (194 degrees), which was above standard operating parameters. The crew consulted manuals and contacted maintenance but found no immediate solution. Concerned about the situation, particularly over water with limited diversion options, the crew decided to divert to ZZZ2. They made a PAN PAN call to inform ATC and contacted dispatch. During descent and landing at ZZZ2, the crew encountered challenges with overweight landing conditions and ATC communication, but the landing was uneventful. Post-landing, maintenance informed the crew that a fume report had been filed by the flight attendants, though the crew had no prior knowledge of fumes or related issues during the flight. Maintenance deferred the APU to prevent further fume events. The crew expressed concerns about the lack of communication from the flight attendants regarding the suspected fume event and questioned the adequacy of maintenance's response. They recommended improved communication protocols between the cockpit and cabin crew, better access to quick reference materials for such situations, and a more thorough investigation of potential issues instead of deferred fixes.",crew-related issues
1937157,Flight Crew,Flight Attendant,"The incident arose from a miscommunication between the flight captain and a flight attendant regarding the handling of a smart bag. Contributing factors included the inexperience of the new ops agent and flight attendant, as well as the captain's distraction while retrieving food, leading to a lack of direct involvement in the bag's handling. The flight attendant initially gate-checked the smart bag, which was later identified as requiring special handling. The ops agent retrieved the bag from the cargo area after being notified. During the flight, the captain noticed the bag in the cabin and pointed out the policy violation. The flight attendant acknowledged the mistake, and the bag's handling was corrected. The smart bag was erroneously loaded into the cargo compartment but was later moved to the passenger cabin. The incident highlighted the need for improved communication and involvement by the captain, especially when dealing with safety-sensitive items like smart bags. The captain reflected on the need to be more involved in the handling of such items and recognized the impact of new staff and distractions on communication. This awareness serves as a lesson for future operations.",crew-related issues
1943492,Flight Attendant,Flight Crew,"The incident involved a hard landing followed by a tail strike, causing the aircraft to skid aggressively on the runway. After passengers deplaned, the initial pilots departed without debriefing the flight attendant. The new Captain was informed about the tail strike and subsequent leak. Maintenance attempted repairs but couldn't fix the issue, leading the Captain to decide against using the aircraft further. As a result, the plane was deferred, and a new aircraft was used.",crew-related issues
1949120,Flight Attendant,Other,"The incident occurred during a flight when a flight attendant received a report from the captain of an unusual odor in the cabin. The flight attendant made an announcement requesting passengers to report any vaping activity or unusual behavior. During her investigation, she noticed Passenger A had a device under her coat that was emitting a sweet odor. Despite the flight attendant's request to hand over the device, Passenger A refused. The flight attendant confiscated the device and isolated it in the galley to identify the source of the odor. After the flight, Passenger A demanded the return of the device and verbally confronted the flight attendant. The flight attendant maintained professionalism and reported the incident to the captain. As a result, Passenger A was banned from the airline. The flight attendant concluded her actions as necessary for cabin safety.",crew-related issues
1787885,Flight Attendant,Ground Personnel,"The incident involved a conflict between a flight attendant and ground personnel during the deplaning process of a full flight. The cleaning crew requested early access to clean the first-class section before all passengers had deplaned, which the flight attendant initially refused. This led to tension, as the cleaning crew and a gate agent, who arrived without a face mask, displayed an attitude. The flight attendant emphasized the importance of passenger safety and deplaning efficiency, citing stress from COVID-related protocols and passenger concerns. After deplaning was complete, the crew faced delays in retrieving their belongings, and the flight deck remained inaccessible. The flight attendant acknowledged potential oversights and expressed a commitment to follow procedures, highlighting the need for safe and efficient passenger experiences.",crew-related issues
1791338,Flight Attendant,Flight Crew,"The incident involved a misunderstanding between a flight attendant and the flight crew regarding the cabin security process. The flight attendant was distracted by a disruptive passenger who refused to wear a mask, leading to an oversight in communication. After addressing the passenger, the flight attendant assumed the flight crew had been informed that the cabin was secure. Similarly, the flight crew believed the flight attendant had communicated the cabin's readiness. This mutual assumption resulted in the cabin not being properly secured before the safety briefing began. Approximately one minute into the briefing, the captain noticed the lack of communication and informed the flight attendant, prompting both parties to re-secure the cabin promptly. The incident was attributed to the distraction caused by the disruptive passenger and the crew's assumption that the other party had handled their respective duties. A potential solution identified was to improve communication protocols and account for habits like the pilots closing the flight deck door for warmth.",crew-related issues
1793055,Flight Attendant,Other,"The incident involved aircraft cleaners in ZZZ not adhering to established policies. They boarded the aircraft before all passengers had deplaned and entered the forward galley during the deplaning process, obstructing passenger flow and creating safety hazards. The cleaners insisted that flight attendants vacate the galley, claiming operational instructions. This led to safety concerns, including trip hazards from cleaning bags left on the floor. A flight attendant tripped over a gray cleaning tote, falling into the bulkhead. The flight attendant reported that cleaners were not following social distancing policies. A solution was proposed: cleaners should wait until all passengers have deplaned before boarding and avoid entering the galley while passengers are present.",crew-related issues
1794733,Flight Attendant,Other,"The incident involved a flight attendant (FA) who failed to conduct an exit row safety briefing during the first leg of a flight due to a lapse in memory. The FA, who had been on extended leave for over a year due to COVID-19-related schedule reductions, attributed the oversight to the disruption of routine caused by the extended absence. The mistake was discovered during the boarding process of the second flight, when the FA was about to conduct the exit row briefing and realized the omission. To prevent recurrence, the FA proposed refreshing their memory and reviewing the work manual to ensure adherence to flight duties. The incident was reported as a safety concern.",crew-related issues
1795437,Flight Attendant,Flight Crew,The incident involved a conflict between a Flight Attendant and the Flight Crew. The Flight Attendant reported that the Captain refused to provide a crew briefing after the attendant requested to maintain social distancing during the briefing. The Captain instructed the attendant to move to the back of the aircraft if they were uncomfortable with the proximity. The Flight Attendant expressed concerns that withholding the briefing could compromise crew and passenger safety. A suggestion was made for the Captain to brief the crew individually when possible.,crew-related issues
1801802,Flight Crew,Flight Attendant,"The incident began when a flight attendant reported a passenger's child resisting the face mask policy. The mother claimed the child was under two years old, exempting the child from the mask requirement. The flight attendant believed this was an attempt to avoid compliance and sought to adjust the weight and balance count. The captain, managing a busy pushback and fatigued from early morning hours, decided to maintain the current count, as the child had a designated seat, suggesting the child was over two. Later, the flight attendant realized she had miscounted the child as a passenger rather than an infant, leading her to alert the captain. She concluded the mother had falsely claimed the child's age. Reflecting on the experience, the flight attendant vowed to verify the age of children in such situations in the future. The outcome was resolved without further incident, with the flight attendant learning to ask passengers about their child's age to ensure accurate counts and compliance.",crew-related issues
1803987,Flight Crew,Flight Attendant,"The incident occurred during a flight when the First Officer (FO) and Captain (CA) were both absent from the cockpit, leaving the aircraft uncontrolled. The First Officer had informed the Captain of the need to use the lavatory, and the flight attendants (FAs) were expected to manage the cockpit exchange. However, during the crew swap, the flight deck door was opened, and the Captain entered the cockpit while no pilot was seated at the controls. Simultaneously, the A FA was in the process of moving from the FO's seat to the Captain's seat, creating a dangerous situation. The FO returned to the cockpit, retook control, and addressed the unsafe procedure with the Captain. The B FA also expressed concerns about the improper exchange. The incident was reported to the Pilot Union Professional Standards, and the FO used it as a teaching moment to emphasize the importance of proper cockpit procedures. The event highlights a critical lapse in safety protocols and underscores the need for adherence to established procedures.",crew-related issues
1805938,Flight Crew,Flight Attendant,"The incident occurred when a Flight Attendant interrupted the sterile cockpit procedure during landing rollout to inform the flight crew about a passenger not complying with the mask policy. This action was contrary to established safety protocols, which reserve cockpit intercom use for emergencies. The flight crew, accustomed to associating such chimes with critical issues, were distracted, potentially compromising safety. The result was a report from the Captain. To address this, guidelines were reissued to clarify acceptable scenarios for cockpit communication during landing, emphasizing the importance of adhering to sterile procedures.",crew-related issues
1809981,Flight Crew,Flight Attendant,"An incident occurred involving the flight crew and flight attendant of an air carrier, where deviations from standard practices led to the omission of a critical checklist. The delay, initially caused by weather in ZZZ, was exacerbated by distractions such as a ramp agent addressing a passenger's mask issue and a faulty headset. These distractions caused both the flight crew and attendant to overlook the completion of the ""before start checklist below the line"" prior to pushback. The crew, attempting to expedite procedures to minimize further delay, was overwhelmed by external distractions, leading to the missed checklist. This omission was only realized after pushback had commenced. The incident resulted in a deviation from standard operating procedures, highlighting the risks of rushing and not prioritizing tasks effectively. Both parties recognized the importance of establishing clear priorities and managing distractions to prevent such omissions. They resolved to improve task management and ensure adherence to checklist protocols in future operations, emphasizing the need for careful prioritization and boundary management to avoid similar incidents.",crew-related issues
1810536,Flight Attendant,Flight Crew,"The incident involved a conflict between a Flight Attendant (FA) and the flight crew due to the FA's hostile behavior toward the pilots, which created an uncomfortable and distressing work environment. On 5/X/21, it was decided to replace the FA for the flight on 5/Y/21, but the replacement was not communicated clearly to the crew. Initially, the crew believed the FA would deadhead (ride without working), but upon discovering she was to work the flight, they were relieved. However, the FA's previous hostile behavior toward the pilots caused the crew significant discomfort, especially after she reappeared on the flight without prior notification. On the day of departure, the crew was shocked to find the FA back on the trip, leading to an awkward and tense atmosphere. The Captain supported removing the FA but faced the dilemma of proceeding with the flight. The company's decision to keep the FA on the flight despite her disruptive behavior created an unhealthy work environment, leaving the crew nervous and unsure about the flight's safety. The flight was completed, but the situation highlighted the need for better communication and conflict resolution. The proposed solution was to honor the initial decision to replace the FA, ensuring a safer and more comfortable work environment for the crew.",crew-related issues
1834448,Flight Crew,Flight Attendant,"The incident involved a discrepancy in the documentation of cabin safety items within the operating manual. A Flight Crew member discovered a deferred cabin item listed in the maintenance logbook under the ""FA (Flight Attendant) Crew Panel"" and attempted to locate relevant information in the operating manuals. Upon reviewing the manuals, it was identified that cabin safety items, such as water shutoff valves, IFE equipment, and ovens, were not included. The Flight Crew member highlighted that these items are critical for flight safety and should be added to the operating manuals immediately. No response or opposing viewpoint was provided by the Flight Attendant. The proposed solution was to update the operating manuals to include the necessary cabin safety items.",crew-related issues
1733955,Flight Attendant,Flight Crew,"The incident arose from a maintenance issue with the R1 door warning strap, which the Flight Attendant noticed during cleaning. She reported the strap was improperly positioned and highlighted worn Velcro causing instability. Despite the First Officer and Captain dismissing her concerns initially, the Flight Attendant persisted, leading to Maintenance being called, who subsequently repaired the strap. The situation highlighted shortcomings in CRM, prompting a later discussion between the Flight Attendant and Captain, resulting in a commitment to improve communication and address such issues more effectively.",crew-related issues
1736305,Flight Attendant,Flight Attendant,"The incident was triggered by a medical situation involving a sick passenger on board a flight from ZZZ to ZZZ1. The flight attendants encountered a vomit episode in the forward lavatory, attributed to a national health concern, and promptly alerted the captain. They maintained effective communication with the flight deck, ensuring the situation was managed with care. The crew coordinated with medical services,Dispatch, and Station Ops, leading to the decision to allow passengers to deplane after the aircraft was cleaned. Additionally, the attendants comforted a passenger whose mother was gravely ill. The flight attendants successfully managed the medical incident, ensuring passenger safety and comfort. Passengers were permitted to deplane post-cleaning, adhering to safety protocols amidst the pandemic, thus resolving the situation effectively.",crew-related issues
1739626,Flight Crew,Flight Attendant,"The incident involved an ERJ145 aircraft during its morning flight. The captain released the parking brake but failed to re-engage it, causing the aircraft to move on the ramp after the engines were started. The first officer, noticing the movement, applied both the brakes and the parking brake, resulting in an abrupt stop. A flight attendant sustained injuries from the sudden stop, including whiplash and bruising. The primary causes of the incident were the captain's oversight in not re-engaging the parking brake after releasing it and the first officer's overreaction to the aircraft's movement. The captain acknowledged a lapse in vigilance during ramp operations without proper communication from ground staff and attributed the first officer's actions to his recent completion of initial operating experience (IOE), indicating a lack of line operation experience. The captain learned the importance of being more vigilant when taxiing without a tug and emphasized the need to address ramp operation threats during pre-flight briefings. Additionally, the incident highlighted the importance of effective crew resource management (CRM) and clear communication to prevent similar occurrences.",crew-related issues
1740938,Flight Attendant,Other,"The flight attendant was demonstrating the oxygen mask use during the safety briefing while wearing her own face mask, which could have led passengers to misunderstand the correct procedure. The cause was her misinterpretation of face mask policies, believing she needed to wear it throughout without exceptions. To address this, she plans to enhance her situational awareness and remove her mask during the demonstration to ensure accurate instruction.",crew-related issues
1741944,Flight Attendant,Ground Personnel,"The incident occurred when a flight attendant observed two policy violations during the flight. First, catering personnel were not wearing masks, which contravened company health and safety protocols. Second, a non-revenue pilot was initially non-compliant with mask-wearing requirements. The flight attendant addressed the pilot, who initially refused but complied temporarily. Upon the attendant leaving, the pilot removed his mask again. The Purser intervened, reminding the pilot to wear his mask, to which he finally complied. The catering issue was reported but not resolved during the flight. The result was the pilot's compliance after two reminders, while the catering staff's non-compliance was noted but addressed through reporting.",crew-related issues
1744573,Flight Attendant,Flight Attendant,"The incident involved two flight attendants on board a flight. Flight Attendant 1 reported that Flight Attendant 2 refused to wear a mask during boarding and throughout the flight. Flight Attendant 1 expressed concern over the risk to passengers' and crew's health due to non-compliance with mask requirements. Flight Attendant 1 also highlighted the discomfort caused by the situation and the potential for conflict between crew members. To address the issue, Flight Attendant 1 suggested that masks should be mandated for all crew members unless there was a medical reason for exemption. The reported incident emphasized the importance of prioritizing health and safety measures to prevent further risks to the cabin environment and crew relations.",crew-related issues
1748574,Flight Attendant,Other,"The incident occurred during a flight when a flight attendant was assisting the purser with boarding procedures, including welcoming passengers and distributing hand sanitizer wipes. While en route to perform her exit row verification-briefing, a passenger from row 10 requested to move to an open seat in the same row instead of sitting in her assigned seat. The flight attendant instructed the passenger to remain seated and approached the purser to seek approval for the seat change. After accommodating the passenger's request, the flight attendant inadvertently bypassed her exit row briefing. Later, during her pre-flight preparations, the flight attendant realized she had not completed the exit row briefing. Upon reaching 10,000 feet and being cleared to move, she promptly returned to her exit row, apologized to the passenger, and conducted the required briefing. She acknowledged that the distraction caused by accommodating the passenger led to her oversight and assured the crew of her commitment to being more diligent in the future.",crew-related issues
